expression,label_cls
muet comme une carpe,langage
ni chair ni poisson,cognition
être laid comme un pou,apparence
être sale comme un pou,comportement
fier comme un pou,morale
chercher des poux à quelqu’un,autre
avoir la puce à l’oreille,cognition
mettre la puce à l’oreille,cognition
secouer les puces à quelqu’un,langage
crier comme un putois,autre
être fait comme un rat,problème
être rat,morale
face de rat,apparence
la montagne accouche d’une souris,autre
un vieux renard,cognition
rusé comme un renard,cognition
avaler des couleuvres,autre
être paresseux comme une couleuvre,comportement
réchauffer un serpent dans son sein,morale
une langue de vipère,langage
faire le singe,comportement
malin comme un singe,cognition
payer en monnaie de singe,autre
méchant comme une teigne,morale
à pas de tortue,temps_espace
nu comme un ver,autre
pas piqué des vers,autre
pas piqué des hannetons,autre
courir comme un zèbre,temps_espace
